{
  "contract_version": "1.0",
  "id": "rarp",
  "name": {
    "ja": "ロボット支援根治的前立腺全摘除術（テスト用フィクスチャ）",
    "en": "Robot-assisted radical prostatectomy (test fixture)"
  },
  "phases": [
    {
      "id": "rarp.p01",
      "name": {
        "ja": "ポート留置・ドッキング",
        "en": "Port placement and docking"
      },
      "order": 1,
      "typical_duration_s": {
        "p25": 420.0,
        "p50": 600.0,
        "p75": 1020.0
      },
      "steps": [
        {
          "id": "rarp.p01.s01",
          "name": {
            "ja": "ポート留置",
            "en": "Port placement"
          },
          "order": 1,
          "typical_duration_s": {
            "p25": 240.0,
            "p50": 360.0,
            "p75": 600.0
          },
          "checkpoints": []
        },
        {
          "id": "rarp.p01.s02",
          "name": {
            "ja": "ロボットのドッキング",
            "en": "Robot docking"
          },
          "order": 2,
          "typical_duration_s": {
            "p25": 120.0,
            "p50": 240.0,
            "p75": 420.0
          },
          "checkpoints": []
        }
      ]
    },
    {
      "id": "rarp.p02",
      "name": {
        "ja": "骨盤リンパ節郭清（任意）",
        "en": "Pelvic lymph node dissection (optional)"
      },
      "order": 2,
      "typical_duration_s": {
        "p25": 900.0,
        "p50": 1500.0,
        "p75": 2400.0
      },
      "steps": [
        {
          "id": "rarp.p02.s01",
          "name": {
            "ja": "リンパ節郭清",
            "en": "Lymph node dissection"
          },
          "order": 1,
          "typical_duration_s": {
            "p25": 900.0,
            "p50": 1500.0,
            "p75": 2400.0
          },
          "checkpoints": [
            {
              "id": "rarp.p02.s01.c1",
              "text": {
                "ja": "閉鎖神経を確認した",
                "en": "Obturator nerve identified"
              }
            }
          ]
        }
      ]
    },
    {
      "id": "rarp.p03",
      "name": {
        "ja": "レチウス腔の展開",
        "en": "Retzius space development / bladder drop"
      },
      "order": 3,
      "typical_duration_s": {
        "p25": 300.0,
        "p50": 480.0,
        "p75": 720.0
      },
      "steps": [
        {
          "id": "rarp.p03.s01",
          "name": {
            "ja": "膀胱の剥離・下垂",
            "en": "Bladder drop"
          },
          "order": 1,
          "typical_duration_s": {
            "p25": 300.0,
            "p50": 480.0,
            "p75": 720.0
          },
          "checkpoints": [
            {
              "id": "rarp.p03.s01.c1",
              "text": {
                "ja": "レチウス腔が十分に展開されている",
                "en": "Space adequately developed"
              }
            }
          ]
        }
      ]
    },
    {
      "id": "rarp.p04",
      "name": {
        "ja": "内骨盤筋膜切開・DVC処理",
        "en": "Endopelvic fascia and DVC control"
      },
      "order": 4,
      "typical_duration_s": {
        "p25": 300.0,
        "p50": 540.0,
        "p75": 900.0
      },
      "steps": [
        {
          "id": "rarp.p04.s01",
          "name": {
            "ja": "内骨盤筋膜の切開",
            "en": "Endopelvic fascia incision"
          },
          "order": 1,
          "typical_duration_s": {
            "p25": 180.0,
            "p50": 300.0,
            "p75": 480.0
          },
          "checkpoints": []
        },
        {
          "id": "rarp.p04.s02",
          "name": {
            "ja": "DVCの結紮",
            "en": "DVC ligation"
          },
          "order": 2,
          "typical_duration_s": {
            "p25": 120.0,
            "p50": 240.0,
            "p75": 420.0
          },
          "checkpoints": [
            {
              "id": "rarp.p04.s02.c1",
              "text": {
                "ja": "DVCが確保されている",
                "en": "DVC secured"
              }
            }
          ]
        }
      ]
    },
    {
      "id": "rarp.p05",
      "name": {
        "ja": "膀胱頸部前壁の切開",
        "en": "Anterior bladder neck dissection"
      },
      "order": 5,
      "typical_duration_s": {
        "p25": 240.0,
        "p50": 420.0,
        "p75": 660.0
      },
      "steps": [
        {
          "id": "rarp.p05.s01",
          "name": {
            "ja": "膀胱頸部前壁の切開",
            "en": "Anterior bladder neck incision"
          },
          "order": 1,
          "typical_duration_s": {
            "p25": 240.0,
            "p50": 420.0,
            "p75": 660.0
          },
          "checkpoints": [
            {
              "id": "rarp.p05.s01.c1",
              "text": {
                "ja": "膀胱頸部を同定した",
                "en": "Bladder neck identified"
              }
            }
          ]
        }
      ]
    },
    {
      "id": "rarp.p06",
      "name": {
        "ja": "膀胱頸部後壁の切開",
        "en": "Posterior bladder neck dissection"
      },
      "order": 6,
      "typical_duration_s": {
        "p25": 300.0,
        "p50": 540.0,
        "p75": 840.0
      },
      "steps": [
        {
          "id": "rarp.p06.s01",
          "name": {
            "ja": "膀胱頸部後壁の切開",
            "en": "Posterior bladder neck incision"
          },
          "order": 1,
          "typical_duration_s": {
            "p25": 300.0,
            "p50": 540.0,
            "p75": 840.0
          },
          "checkpoints": [
            {
              "id": "rarp.p06.s01.c1",
              "text": {
                "ja": "尿管口を確認した",
                "en": "Ureteral orifices identified"
              }
            }
          ]
        }
      ]
    },
    {
      "id": "rarp.p07",
      "name": {
        "ja": "精嚢・精管の剥離",
        "en": "Seminal vesicle and vas dissection"
      },
      "order": 7,
      "typical_duration_s": {
        "p25": 360.0,
        "p50": 600.0,
        "p75": 960.0
      },
      "steps": [
        {
          "id": "rarp.p07.s01",
          "name": {
            "ja": "精管の切断",
            "en": "Vas deferens division"
          },
          "order": 1,
          "typical_duration_s": {
            "p25": 120.0,
            "p50": 180.0,
            "p75": 300.0
          },
          "checkpoints": []
        },
        {
          "id": "rarp.p07.s02",
          "name": {
            "ja": "精嚢の剥離",
            "en": "Seminal vesicle dissection"
          },
          "order": 2,
          "typical_duration_s": {
            "p25": 240.0,
            "p50": 420.0,
            "p75": 660.0
          },
          "checkpoints": [
            {
              "id": "rarp.p07.s02.c1",
              "text": {
                "ja": "精嚢が完全に遊離されている",
                "en": "Seminal vesicles fully mobilised"
              }
            }
          ]
        }
      ]
    },
    {
      "id": "rarp.p08",
      "name": {
        "ja": "後面剥離（デノンビリエ筋膜）",
        "en": "Posterior dissection (Denonvilliers)"
      },
      "order": 8,
      "typical_duration_s": {
        "p25": 240.0,
        "p50": 420.0,
        "p75": 720.0
      },
      "steps": [
        {
          "id": "rarp.p08.s01",
          "name": {
            "ja": "デノンビリエ筋膜面の剥離",
            "en": "Denonvilliers plane dissection"
          },
          "order": 1,
          "typical_duration_s": {
            "p25": 240.0,
            "p50": 420.0,
            "p75": 720.0
          },
          "checkpoints": [
            {
              "id": "rarp.p08.s01.c1",
              "text": {
                "ja": "正しい剥離層で、直腸が安全である",
                "en": "Correct plane, rectum safe"
              }
            }
          ]
        }
      ]
    },
    {
      "id": "rarp.p09",
      "name": {
        "ja": "側方茎処理・神経温存",
        "en": "Pedicle control and nerve sparing"
      },
      "order": 9,
      "typical_duration_s": {
        "p25": 600.0,
        "p50": 1020.0,
        "p75": 1680.0
      },
      "steps": [
        {
          "id": "rarp.p09.s01",
          "name": {
            "ja": "側方茎の処理",
            "en": "Pedicle control"
          },
          "order": 1,
          "typical_duration_s": {
            "p25": 300.0,
            "p50": 480.0,
            "p75": 780.0
          },
          "checkpoints": []
        },
        {
          "id": "rarp.p09.s02",
          "name": {
            "ja": "神経温存",
            "en": "Nerve sparing"
          },
          "order": 2,
          "typical_duration_s": {
            "p25": 300.0,
            "p50": 540.0,
            "p75": 900.0
          },
          "checkpoints": [
            {
              "id": "rarp.p09.s02.c1",
              "text": {
                "ja": "神経温存のグレードを決めた",
                "en": "Nerve-sparing grade decided"
              }
            }
          ]
        }
      ]
    },
    {
      "id": "rarp.p10",
      "name": {
        "ja": "尖部処理・尿道切断",
        "en": "Apical dissection and urethral transection"
      },
      "order": 10,
      "typical_duration_s": {
        "p25": 300.0,
        "p50": 540.0,
        "p75": 900.0
      },
      "steps": [
        {
          "id": "rarp.p10.s01",
          "name": {
            "ja": "尖部の剥離",
            "en": "Apical dissection"
          },
          "order": 1,
          "typical_duration_s": {
            "p25": 240.0,
            "p50": 420.0,
            "p75": 660.0
          },
          "checkpoints": []
        },
        {
          "id": "rarp.p10.s02",
          "name": {
            "ja": "尿道の切断",
            "en": "Urethral transection"
          },
          "order": 2,
          "typical_duration_s": {
            "p25": 60.0,
            "p50": 120.0,
            "p75": 240.0
          },
          "checkpoints": [
            {
              "id": "rarp.p10.s02.c1",
              "text": {
                "ja": "尿道長を温存し、断端を確認した",
                "en": "Urethral length kept, margin checked"
              }
            }
          ]
        }
      ]
    },
    {
      "id": "rarp.p11",
      "name": {
        "ja": "後壁再建（Rocco、任意）",